{"$schemaId":"https://schemas.cp6.dev/release/pinned-trust-store.v1","acceptedHistoricalPolicyVersions":[1,2],"keys":[{"keyId":"sha256:aaaaaaaaaaaaaaaaaaaaaaaaaaaaaaaaaaaaaaaaaaaaaaaaaaaaaaaaaaaaaaaa","publicKey":"dGVzdA==","purpose":"candidate-locator","revocationReason":"Routine test revocation.","revokedAtUtc":"2026-08-01T00:00:00.000Z","validFromUtc":"2026-01-01T00:00:00.000Z","validUntilUtc":"2027-01-01T00:00:00.000Z"},{"keyId":"sha256:bbbbbbbbbbbbbbbbbbbbbbbbbbbbbbbbbbbbbbbbbbbbbbbbbbbbbbbbbbbbbbbb","publicKey":"dGVzdA==","purpose":"candidate-locator","validFromUtc":"2026-01-01T00:00:00.000Z","validUntilUtc":"2027-01-01T00:00:00.000Z"}],"minimumAcceptedPolicyVersion":2,"policyVersion":3,"storageAuthorities":[{"accessMode":"AuthenticatedReadConditionalCreate","accountId":"11111111111111111111111111111111","allowedPrefixes":["candidates/platform/","objects/sha256/"],"bucket":"cp6-release","endpointTemplate":"https://{accountId}.r2.cloudflarestorage.com","id":"cp6-release-r2-v1","jurisdiction":"default","maxObjectBytes":4194304,"provider":"cloudflare-r2"}]}